"","num","experiment","replicate","n","r","z","vz"
"168",121,"The sunny side of fairness: Preference for fairness activates reward circuitry (and disregarding unfairness activates self-control circuitry)",1,24,0.828997685,1.18492314412419,0.0476190476190476
"169",122,"The representation of simple ensemble visual features outside the focus of attention",1,17,0.922934494,1.60847594653146,0.0714285714285714
"170",124,"Loving those who justify inequality: the effects of system threat on attraction to women who embody benevolent sexist ideals.",1,70,-0.034279559,-0.0342929956428472,0.0149253731343284
"171",127,"A motion aftereffect from still photographs depicting motion",1,26,0.527307869,0.58640880552693,0.0434782608695652
"172",129,"The threat of appearing prejudiced and race-based attentional biases.",1,66,0.017674908,0.0176767489061405,0.0158730158730159
"173",132,"Where do we look during potentially offensive behavior?",1,30,0.179397898,0.181360494878753,0.037037037037037
"174",133,"Adaptive memory: The comparative value of survival processing.",1,38,0.423363806,0.451783336020072,0.0285714285714286
"175",134,"Is happiness having what you want, wanting what you have, or both?",1,238,0.500179963,0.549546123796944,0.00425531914893617
"176",135,"Implicit attitude generalization occurs immediately; explicit attitude generalization takes time",1,3597,0.105891025,0.10628949138422,0.000278241513633834
"177",136,"The value of believing in free will: Encouraging a belief in determinism increases cheating.",1,58,0.102355162,0.102714869812966,0.0181818181818182
"178",139,"Auditory change detection: simple sounds are not memorized better than complex sounds",1,5,0.505151268,0.556198279242192,0.5
"179",140,"Keeping one's distance: The influence of spatial distance cues on affect and evaluation.",1,125,0.044266281,0.0442952283539177,0.00819672131147541
"180",142,"Hedonic and instrumental motives in anger regulation.",1,88,0.609913782,0.708784059252991,0.0117647058823529
"181",143,"Creating social connection through inferential reproduction: Loneliness and perceived agency in gadgets, gods, and greyhounds.",1,78,0.061707156,0.0617856577111544,0.0133333333333333
"182",145,"ñIn_Group Loveî and ñOut_Group Hateî as Motives for Individual Participation in Intergroup Conflict: A New Game Paradigm",1,120,0.652982567,0.780480766803962,0.00854700854700855
"183",146,"A word-order constraint on phonological activation",1,12,0.497082522,0.545423705409234,0.111111111111111
"184",148,"The Best Men Are (Not Always) Already Taken: Female Preference for Single Versus Attached Males Depends on Conception Risk",1,263,-0.030172295,-0.0301814559621975,0.00384615384615385
"185",149,"The Best Men Are (Not Always) Already Taken: Female Preference for Single Versus Attached Males Depends on Conception Risk",1,318,0.018283411,0.0182854486872587,0.00317460317460317
"186",150,"Sensitivity to object viewpoint and action instructions during search for targets in the lower visual field",1,19,0.207514339,0.210572424096054,0.0625
"187",151,"With a clean conscience: Cleanliness reduces the severity of moral judgments.",1,126,0.002839798,0.00283980563384237,0.00813008130081301
"188",153,"Extremal edge: a powerful cue to depth perception and figure-ground organization",1,8,0.120073568,0.120655671934318,0.2
"189",154,"What Do Cross_National Comparisons of Personality Traits Tell Us? The Case of Conscientiousness",1,16,0.11,0.110446915790097,0.0769230769230769
"190",155,"Personality dominance and preferential use of the vertical dimension of space",1,72,-0.034,-0.0340131104279282,0.0144927536231884
"191",158,"Conflict-triggered goal shielding: Response conflicts attenuate background monitoring for prospective memory cues.",1,95,0.411336583,0.437218946739661,0.0108695652173913
"192",161,"Detecting the snake in the grass: attention to fear-relevant stimuli by adults and young children.",1,48,0.177837588,0.179748763345337,0.0222222222222222
"193",165,"The value heuristic in judgments of relative frequency.",1,51,-0.175454592,-0.177289012352195,0.0208333333333333
"194",167,"Head up, foot down: Object words orient attention to the objects' typical location.",1,22,0.25414164,0.259835474573725,0.0526315789473684
