V1,V2,V3,V4,V5,V6,V7,V8,V9,V10,Q1.1,Q1.2,Q1.3,Q2.1,Q2.2_1,Q2.2_2,Q2.2_3,Q2.2_4,Q2.3_1,Q2.3_2,Q2.3_3,Q2.3_10,Q2.4_1,Q2.4_2,Q2.4_3,Q2.4_4,Q2.5_1,Q2.5_2,Q2.5_3,Q2.5_4,Q2.6_1,Q2.6_2,Q2.6_3,Q2.6_4,Q2.7_1,Q2.7_2,Q2.7_3,Q2.7_4,Q2.8_1,Q2.8_2,Q2.8_3,Q2.8_4,Q2.9_1,Q2.9_2,Q2.9_3,Q2.9_4,Q2.10_1,Q2.10_2,Q2.10_3,Q2.10_4,Q2.11_1,Q2.11_2,Q2.11_3,Q2.11_4,Q2.12_1,Q2.12_2,Q2.12_3,Q2.12_4,Q2.13_1,Q2.13_2,Q2.13_3,Q2.13_4,Q3.1,Q3.2,Q3.3_1,Q3.3_2,Q3.3_3,Q3.3_4,Q3.3_5,Q3.3_6,Q3.3_7,Q4.1_1,Q4.1_2,Q4.1_3,Q4.1_4,Q4.1_5,Q4.2_1,Q4.2_2,Q4.2_3,Q4.2_4,Q4.2_5,Q4.3_1,Q4.3_2,Q4.3_3,Q4.3_4,Q4.3_5,Q4.4_1,Q4.4_2,Q4.4_3,Q4.4_4,Q4.4_5,Q4.5_1,Q4.5_2,Q4.5_3,Q4.5_4,Q4.5_5,Q4.6_1,Q4.6_2,Q4.6_3,Q4.6_4,Q4.6_5,Q4.7_1,Q4.7_2,Q4.7_3,Q4.7_4,Q4.7_5,Q4.8_1,Q4.8_2,Q4.8_3,Q4.8_4,Q4.8_5,Q5.1,Q5.1_TEXT,Q5.2,Q5.3,Q5.3_TEXT,Q5.4,Q5.5,Q5.5_TEXT,Q5.6,Q5.7,Q5.8,Q5.9,Q5.10,Q6.1,Q6.2,Q6.3,Q6.4,Q6.5,Q6.6,Q6.7,Q6.8,Q6.9,Q51,Q7.1,Q7.2,LocationLatitude,LocationLongitude,LocationAccuracy,Exclude
R_2wtQ3DhCQjUQ8xJ,Default Response Set,Anonymous,,,139.62.163.127,0,11/30/2015 14:14,11/30/2015 15:21,1,F099,1,1,1,4,8,5,0,0,0,1,8,0,8,0,0,4,4,1,8,0,3,4,2,0,0,4,8,0,8,0,8,3,0,4,3,0,0,0,8,8,1,3,0,8,4,1,0,8,0,2,0,1,1,8,8,8,0,8,8,8,5,3,6,1,7,3,5,2,1,1,3,2,3,3,5,3,7,2,6,1,3,3,2,7,1,2,5,4,2,4,2,1,7,3,4,7,6,4,2,4,2,,22,4,,1,4,,0,5,1,25,1,1,1,No,To understand the many dynamics of relationships from differing perspectives.,To gain insight into attitudes towards relationships from a number of different perspectives and demographics.,Yes because it was all related to attitudes towards relationships.,Not really,I didn't look at my neighbor's paper so I don't know.,1,1,2,Fuglestad,30.28779602,-81.42639923,-1,0
R_WAqfi1b7HlykBnb,Default Response Set,Anonymous,,,139.62.7.154,0,10/9/2015 10:43,10/9/2015 11:47,1,M001,1,1,1,1,6,5,1,2,1,1,6,1,5,2,1,6,1,3,3,1,0,3,6,5,2,4,1,2,0,2,4,4,6,5,0,0,2,4,2,7,5,6,1,3,6,2,5,1,4,7,2,1,1,5,7,6,5,5,4,4,5,2,4,5,4,5,3,4,4,5,2,4,4,3,6,5,4,2,5,2,3,4,5,2,2,2,4,6,6,6,1,3,4,4,5,6,6,7,2,6,1,,29,3,,1,3,,1,3,4,20,1,1,1,No,To get me thinking about my relationship.,To see how people feel about relationships and how serious they are after what amount of time.,"Yes, the paper seemed to be like part 1 of the study.","Not really, it just got me thinking about what I really want to get out of this relationship.",Some might have gotten people to think negatively about their current relationship,1,1,1,Fuglestad,30.28779602,-81.42639923,-1,1
R_1j9UAiYENqkaP9U,Default Response Set,Anonymous,,,139.62.7.233,0,10/9/2015 14:30,10/9/2015 15:54,1,M002,1,1,1,4,1,0,7,6,0,4,7,8,8,1,0,1,6,0,7,4,6,1,1,1,4,6,0,1,6,5,8,6,2,1,0,3,1,4,7,2,3,6,3,5,7,1,1,3,5,4,2,1,1,7,6,8,2,7,7,7,2,6,2,7,3,7,7,2,3,4,2,4,1,4,2,6,4,7,5,7,7,2,7,1,4,2,5,4,7,2,4,1,7,1,7,4,7,2,3,2,1,,27,4,,1,4,,7,4,1,30,1,1,1,"The ""speed limit"" questions and the  ""littering"" questions, etc seemed sort of irrelevant. I suppose it was to further inspect the accuracy of my self-monitoring.","To report, in a general way, on the involvement or viewpoint of myself in my own relationship.",To answer hypothetical questions regarding possible instances or events that may arise in my relationship-- mostly undesirable hypotheses. ,"They both involved relationships. However, the ""paper"" study was more a general self-report, while the computerized study involved hypothetical instances which required a bit more introspection.","No, but some of my reporting on the ""paper"" study was inconsistent with the ""computer"" study.",I don't know how to answer this. I was the sole participant in the lab on this particular day. I would imagine that the prompts would be uniform for data collection purposes.,1,1,1,Fuglestad,30.28779602,-81.42639923,-1,1
R_1hLr4WR6K7CGPmF,Default Response Set,Anonymous,,,139.62.163.127,0,10/15/2015 14:32,10/15/2015 15:35,0,m003,1,1,1,1,8,6,3,2,0,1,6,0,8,1,1,3,1,6,7,0,7,4,7,5,0,8,1,4,8,5,8,6,1,7,0,0,0,7,0,6,8,6,0,1,7,7,7,2,4,7,0,1,1,8,8,8,2,8,8,8,5,6,3,7,7,7,6,2,7,2,3,1,7,2,7,1,7,2,7,6,7,1,7,1,4,2,7,1,1,7,4,1,7,7,7,3,7,7,7,1,1,,22,4,,1,4,,0,2,1,30,1,1,1,No.,To determine the trajectory of my current relationship.,To determine the current state of my relationship and any characteristics I may have that could cause our relationship to end.,"Yes, the paper study was to determine the trajectory of my relationship and the online study determined the current state of my relationship.",No.,"No, I think they differed based on gender.",1,1,2,Fuglestad,,,-1,0
R_3MQljcjNCjBX6nm,Default Response Set,Anonymous,,,139.62.146.125,0,10/16/2015 10:48,10/16/2015 11:46,1,M004,1,1,1,0,6,0,0,0,2,2,7,0,8,0,0,8,0,5,7,0,4,0,8,8,0,8,0,0,8,8,8,6,0,8,0,0,0,7,7,8,8,4,0,4,8,0,6,0,0,6,0,1,1,8,8,8,0,8,8,8,6,3,1,7,4,1,7,1,7,7,3,7,1,1,7,4,5,7,7,7,7,1,7,1,1,2,7,4,7,7,7,1,7,1,4,4,1,7,4,4,1,,20,3,,1,4,,3,11,1,27,1,1,1,"No, everything was very clear and easy to understand.",It was administered in order to see if talking about the positive aspects of a relationship would result in positive answers in this questionnaire.,Gathering data about people involved in romantic relationships.,They are both concerning romantic relationships which is how they are related.,I'm not sure. I haven't thought about it while completing the study.,I'm not sure whether other people received the same prompts or not. I assume they have just to keep the study consistent and valid.,1,1,1,Fuglestad,30.28779602,-81.42639923,-1,2
R_28HSLNgjeKHquzV,Default Response Set,Anonymous,,,139.62.4.237,0,10/19/2015 10:24,10/19/2015 11:09,1,M005,1,1,1,1,6,3,1,0,0,4,4,8,8,0,0,5,2,7,2,2,1,5,6,5,1,5,3,2,1,7,8,7,1,5,0,1,3,6,2,7,5,4,1,7,3,5,4,3,2,1,2,1,1,8,7,7,1,6,7,8,7,5,5,2,4,7,6,2,6,7,1,4,4,2,6,4,5,2,6,3,4,2,1,1,6,3,4,4,1,4,1,2,6,1,1,7,6,7,4,3,1,,21,4,,1,4,,3,1,1,26,1,1,1,I guess the fact that it went from asking dating questions to asking if I had stolen before but I believe that's to judge the person's characters/ see what they think about right and wrong.,To determine how and why you feel the ways about a current/potential long term relationship.,To figure out how I would react to my partner doing things that may annoy or anger me.,"Yes, because you have to be able to work through the dating issues to be able to make it long term.",I don't believe it did.,Everyone did to my knowledge.,1,1,1,Fuglestad,30.28779602,-81.42639923,-1,0
R_3GdmFcUS2QufwjQ,Default Response Set,Anonymous,,,139.62.163.52,0,10/19/2015 14:47,10/19/2015 15:18,1,M006,1,1,1,3,8,4,1,2,2,7,8,7,7,1,4,7,1,4,7,4,1,4,8,0,8,0,0,4,0,4,4,0,0,8,0,0,0,8,0,7,8,8,0,7,7,0,7,0,0,7,0,1,1,6,6,2,7,4,4,4,7,1,1,1,7,3,3,1,1,1,4,1,7,1,6,1,7,1,7,1,2,2,2,4,1,4,2,2,1,2,4,1,7,1,4,2,4,7,2,2,1,,38,3,,1,4,,4,6,1,31,1,1,1,Nothing.,Improvement in study question.,Relationship questions.,They correlated with relationship information.,"Yes, it prepared me for an environment with similiar question.",The promts were the same.,1,1,2,Fuglestad,30.28779602,-81.42639923,-1,1
R_3j8t7neN5mPGSLF,Default Response Set,Anonymous,,,139.62.165.89,0,10/29/2015 14:20,10/29/2015 15:46,1,m007,1,1,1,0,6,2,3,0,0,1,0,8,8,0,0,1,4,7,5,0,5,2,6,8,5,8,0,1,6,8,8,7,2,3,0,0,5,7,5,6,6,5,0,2,7,0,7,1,2,5,0,1,1,7,8,7,1,8,7,8,7,5,4,5,5,4,4,2,6,3,3,6,7,6,5,3,6,7,7,3,3,3,1,1,2,6,5,1,1,4,1,2,7,7,7,6,7,1,3,6,1,,22,3,,1,5,,5,1,1,29,1,1,1,It seemed strange that I had to answer a lot of questions about how truthful or dishonest I am.,"The purpose was to get a general idea on what I think are negative qualities of my partner, and my opinion on romantic relationships.","The purpose was to rate how I think that I would react to my partner, if they had been involved in situations that would hurt me emotionally. ","Yes, if I have a more negative view on my partner, on the paper survey, then I would probably have more negative reactions on the computer survey.",No they did not.,I do not know. Another participant probably got a prompt to describe what they thought to be positive aspects of their partner. I received a writing prompt telling me to describe negative aspects. ,1,1,2,Fuglestad,30.28779602,-81.42639923,-1,2
R_UmA7TMeqReYV0IN,Default Response Set,Anonymous,,,139.62.163.127,0,11/5/2015 13:22,11/5/2015 15:42,1,M008,1,1,1,4,6,6,0,0,0,5,0,1,8,8,2,6,2,7,3,8,0,6,2,2,4,6,0,5,0,8,8,6,1,4,1,0,3,1,4,8,8,8,0,0,6,0,7,1,1,6,0,1,1,8,8,6,1,8,8,8,5,2,7,3,3,3,7,3,7,7,4,2,1,1,6,1,6,6,7,4,4,2,2,1,2,2,4,4,2,5,7,2,7,7,7,2,7,7,3,7,1,,18,2,,1,4,,2,7,1,20,1,1,1,Everything seemed normal to me.,to determine if people in a future study would understand what the questions are asking. ,To determine how people in relationship would respond to hypothetical situations.,"Yes, the first study did ask about my relationship. This was the also the focus of the second study.","possibly, it makes you start thinking about your partner in certain ways as opposed to just maybe remembering the most recent time you saw them.",Unsure.,1,1,2,Fuglestad,30.28779602,-81.42639923,-1,0
R_Tno8pkSpccPhORb,Default Response Set,Anonymous,,,139.62.5.47,0,11/9/2015 13:18,11/9/2015 14:05,1,M009,1,1,1,0,8,6,0,5,0,2,8,4,5,7,3,8,3,3,8,0,6,2,8,0,8,5,2,5,6,6,8,6,1,5,1,0,6,3,4,8,8,6,1,5,5,1,6,5,2,7,1,1,1,8,8,8,0,8,8,8,6,6,4,6,6,6,7,1,6,6,2,3,1,2,5,2,4,4,6,4,7,2,7,1,6,2,7,2,7,3,7,1,7,1,7,2,7,2,5,3,1,,23,4,,1,4,,1,6,1,31,1,1,1,"No, nothing about the study seemed strange at all.",I think the purpose of the pilot study was just to get an idea of how I feel about my relationship or relationships in general before introducing more specific scenarios.,I think the purpose of the main study was to see how different people would react to different scenarios depending on how long or how exclusive the relationship was and how that might differ for people in serious relationships versus people who are not in serious relationships.,"Yes, they were both concerning relationships.",I don't believe that they did influence my responses to the main study.,"I am not sure if everyone received the same writing prompts, I was the only one in the study.",1,1,2,Fuglestad,30.28779602,-81.42639923,-1,0
R_2qBM3A9iQdIa93O,Default Response Set,Anonymous,,,139.62.163.127,0,11/9/2015 14:23,11/9/2015 15:27,1,M010,1,1,1,3,6,6,1,3,0,1,5,0,6,1,1,6,1,6,1,1,4,6,3,3,1,3,0,1,4,4,5,3,1,4,0,1,2,5,1,5,5,6,1,2,5,0,5,1,2,5,0,1,1,7,7,7,1,6,7,7,5,4,5,4,5,5,3,3,6,4,4,3,6,5,5,4,5,4,5,5,3,3,4,2,1,5,5,4,1,5,2,2,5,2,5,5,5,5,4,4,1,,20,3,,1,4,,2,0,1,22,1,1,1,"The differences between ""dating regularly"" vs ""dating steadily"" ","It highlighted the positive parts of the relationship, not the negative parts. It also allowed for open ended responses which can give good insight.",To understand about what people are interested in in a relationship. Some of the questions were asking about how forgiving you may be in your relationship. ,Both were about the relationship. The written part was more positive and the online part had some negative aspects to it. ,I don't believe so purely because I viewed each situation independently. If anything it may have made my negative responses less harsh,I was the only one for this time slot. Id assume if someone was given a prompt that focused on the negative aspects of someones relationship that it would probably influence their responses on the online portion accordingly. ,1,1,1,Fuglestad,30.28779602,-81.42639923,-1,0
R_1LLNLB2CB5ND22u,Default Response Set,Anonymous,,,139.62.163.127,0,11/9/2015 15:28,11/9/2015 16:26,1,M011,1,1,1,0,2,6,1,1,0,5,6,0,7,0,4,6,0,6,0,0,0,7,7,0,3,8,0,0,0,0,6,7,0,6,0,0,0,0,0,4,7,8,0,0,8,0,8,1,0,7,0,1,1,8,8,8,0,8,4,4,1,4,5,6,7,5,2,1,4,4,4,2,6,3,6,2,5,5,6,7,5,3,5,1,1,7,6,2,1,1,1,1,6,1,5,6,6,7,1,4,1,,20,2,,1,3,,0,1,1,24,1,1,1,no,to descripe relationships,understand dating relationships,"yes, they asks similar questions / ",no,N/A,1,1,2,Fuglestad,30.28779602,-81.42639923,-1,0
R_294gXsrO3dEPDRj,Default Response Set,Anonymous,,,139.62.165.89,0,11/10/2015 13:35,11/10/2015 14:36,1,m012,1,1,1,4,8,4,0,0,5,0,8,0,0,8,0,8,2,8,6,3,0,0,8,8,0,8,0,2,1,8,8,8,0,6,0,0,3,6,0,6,8,8,0,8,8,0,8,2,8,5,0,1,1,8,8,8,0,8,8,8,7,5,5,3,7,3,3,1,6,3,4,3,4,5,5,3,7,1,7,2,7,1,5,7,1,4,3,1,1,7,2,7,7,6,7,5,7,1,2,7,1,,19,3,,1,4,,2,2,1,25,1,1,1,"Asking a Boolean (""I have never..."") question with answers on a 1-7 scale seems strange. The intent of the question is clear, but stating the question that way might skew the data.",To see if the questions provided would create usable data.,"To attempt to find possible correlation between attitudes, demographics, and personality in a dating relationship. ","Yes, they shared the theme of ""relationships"".",No.,I assume so.,1,1,2,Fuglestad,30.28779602,-81.42639923,-1,0
R_3finQCZdy7b70jl,Default Response Set,Anonymous,,,139.62.163.52,0,11/13/2015 14:44,11/13/2015 15:35,1,M013,1,1,1,0,6,4,2,5,3,3,7,1,6,3,2,3,4,3,7,1,1,4,7,7,1,2,0,0,3,0,7,3,0,4,2,1,6,2,3,5,6,4,1,5,7,2,5,1,6,6,0,1,1,8,7,8,1,8,7,8,4,5,3,6,5,7,3,2,6,4,2,3,6,2,4,2,5,6,7,7,4,2,3,1,2,3,5,2,2,3,1,2,7,1,7,7,6,1,4,5,1,,20,2,,1,3,,2,4,1,23,1,1,1,nothing seemed strange enough for me to notice.,Pre-test data for a class.,To study dating relationships.,"Yes, they were both about romantic partners.","Maybe a little bit because, I was thinking about the best of my partner and how much I care for her.",I believe everybody recieved the same prompt.,1,1,2,Fuglestad,30.28779602,-81.42639923,-1,0
R_3mkvumAwx4KZ56E,Default Response Set,Anonymous,,,139.62.145.250,0,11/16/2015 12:28,11/16/2015 13:06,1,M014,1,1,1,2,7,5,2,0,4,4,6,0,8,6,1,5,8,5,3,2,8,4,7,6,3,7,0,3,8,8,7,7,1,7,0,0,5,8,0,6,6,6,2,5,6,4,7,3,5,7,1,1,1,8,8,8,0,8,8,8,2,3,5,2,5,5,5,2,7,5,1,4,7,6,5,4,6,3,7,6,7,1,7,1,4,6,7,3,7,6,2,1,7,1,7,6,1,2,5,3,1,,21,4,,1,4,,1,0,1,31,1,1,1,"The questions in the last part of the study confused me. For instance, what does driving over the speed limit or damaging a library book without reporting it have to do with the study? Also, I answered the last part of the study throughout my entire life and comparing my life to who I am now in my current dating relationship is very different since I have grown up and am not the same person I was when I was a teenager.",The purpose was to see just how attached I felt to my dating partner.,The purpose was to see how you would address hypothetical issues with your dating partner. The answers that I provided was to see if my thoughts on how strong our relationship is matched the strength I believed our relationship has. ,The two studies both consisted of my dating relationship and measuring the strength of the relationship. ,I don't think it did. I would have answered the main study the same way without the pilot study. ,"Possibly, the prompts could have differed by the view of the relationship. One prompt could ask questions about the relationship in a positive light, and the other prompts could be questions reflecting on negative aspects of the relationship. ",1,1,1,Fuglestad,30.28779602,-81.42639923,-1,2
R_1MZhRcywzy0P7ix,Default Response Set,Anonymous,,,139.62.150.134,0,11/23/2015 11:19,11/23/2015 13:57,1,M015,1,1,1,2,7,6,3,4,2,3,5,1,7,3,2,6,2,4,6,2,3,4,6,2,4,3,2,1,5,1,7,3,4,6,3,2,5,4,2,8,7,8,1,5,5,1,6,7,3,6,1,1,1,6,5,4,7,4,2,4,6,4,3,5,6,4,6,3,4,4,4,3,4,2,5,3,5,6,5,5,5,2,5,1,3,3,6,5,2,7,5,2,7,1,7,4,7,6,4,3,1,,22,4,,1,3,,0,5,1,18,1,1,1,"The paper questionnaire and the computer test are clearly part of the same study, even though they are presented as unrelated. The content of the computer test also started to veer away from talking about relationships and starting asking more inward, reflective questions about the self. This seemed odd.",It was a short survey asking us to describe various parts of our relationships.,"To gauge how ""into"" the relationship we are in relation to how we judge ourselves.","They both asked related content (on relationships), however the paper questionnaire was more long-term oriented.","Yes, it made me think about the lasting effects of the relationship before I thought of the simple, everyday things.","I have no clue, I didn't see the other participants' paper...",1,1,1,Fuglestad,30.28779602,-81.42639923,-1,1
R_Zk1LKx3yaIPbvsR,Default Response Set,Anonymous,,,139.62.165.89,0,11/23/2015 15:09,11/23/2015 16:39,1,M016,1,1,1,3,2,2,1,3,1,1,3,1,2,2,6,2,2,3,1,1,1,2,4,3,1,3,0,2,3,1,5,2,2,2,0,1,1,3,2,5,2,2,1,4,1,1,1,3,1,2,1,1,1,6,7,5,2,5,5,5,6,4,4,3,3,4,3,3,5,2,3,5,4,3,5,3,5,1,4,6,4,3,4,1,4,2,4,6,2,4,2,2,6,3,5,3,5,6,6,3,1,,18,1,,1,4,,1,3,1,20,1,1,1,nope,To see what we would do in certain situations with our partner,To get info about how we handle relationships,"Yes, they were both asking questions about relationships",nope,Yes,1,1,1,Fuglestad,30.28779602,-81.42639923,-1,0
R_29azLK5sS8diPZD,Default Response Set,Anonymous,,,139.62.163.52,0,11/30/2015 14:12,11/30/2015 15:19,0,M017,1,1,1,4,3,6,2,2,1,1,4,1,1,1,4,4,1,6,2,1,1,7,7,4,4,4,2,2,1,4,1,6,1,3,4,1,1,5,1,6,6,6,2,4,6,1,6,1,6,6,1,1,1,6,6,6,2,6,6,6,4,4,5,5,4,4,4,3,4,3,4,4,4,4,4,4,5,3,4,4,3,4,4,1,3,4,4,5,4,7,1,3,5,3,5,6,6,3,5,5,1,,35,4,,1,2,,2,1,1,21,1,1,1,"The voting questions, and the stealing questions.","describing relationships, but has some interesting characteristics.","Topics about casual relationships, but had some questions about personal morality and character.","Related in describing relationships in a way, but the computer version had more personal questions based on an individuals character.","Not really, the questions on paper seemed to be traits independent of my partner. The questions administered by the test seemed to have more personal view questions especially the voting question.","It is a possibility, or it could have differed if we looked at it from my partners point of view of describing me.",1,1,2,Fuglestad,,,-1,1
R_1MZkEn0J6loDY2X,Default Response Set,Anonymous,,,139.62.163.127,0,12/16/2015 12:47,12/16/2015 13:33,1,M018,1,1,1,0,1,3,0,1,0,6,2,7,4,1,3,4,1,2,2,0,0,5,0,3,0,0,5,3,7,4,7,4,1,7,1,0,0,8,0,6,5,3,0,0,0,0,7,1,3,4,0,1,1,6,5,5,5,3,6,3,2,5,4,2,5,7,3,4,4,2,1,6,5,5,6,1,5,7,7,3,7,3,7,1,1,3,2,5,2,4,2,1,5,1,7,5,1,5,5,7,1,,31,3,,1,2,,0,4,3,8,1,1,1,No,To gain an understanding of the test subject,Reactions to dating situations,"Yes, both about dating",No,N/A,1,1,2,Fuglestad,30.28779602,-81.42639923,-1,1
R_ZmHvexWRrW108Sd,Default Response Set,Anonymous,,,139.62.163.127,0,1/12/2016 13:38,1/12/2016 14:39,1,m019,1,1,1,0,4,8,0,0,0,2,8,8,4,8,0,2,0,6,4,0,0,8,8,8,0,8,0,4,0,1,7,8,0,8,0,0,4,8,0,8,8,8,0,4,8,0,8,4,6,8,0,1,1,8,8,8,4,8,7,8,7,1,7,4,7,4,7,1,1,4,4,7,7,4,7,6,7,1,7,1,2,7,4,4,1,7,4,7,1,4,7,7,7,7,7,1,7,7,1,7,1,,31,3,,1,4,,8,2,1,13,1,1,1,"why is the study being conducted and the purpose of its research, also the privacy of the data.",to conduct relationship matters.,relationships.,they were related by the emotion connected from one person to another.,no,"probably, yes",1,1,1,Fuglestad,30.28779602,-81.42639923,-1,1
R_265MUQqXqz6b3EW,Default Response Set,Anonymous,,,139.62.165.89,0,1/12/2016 13:38,1/12/2016 14:39,1,m020,1,1,1,1,7,6,3,3,0,2,7,4,6,5,2,7,4,7,4,2,1,7,7,7,0,5,0,6,3,0,6,4,0,6,0,1,7,6,5,6,8,8,2,5,8,0,8,3,5,8,1,1,1,7,7,8,3,8,4,3,5,6,2,7,3,5,4,5,1,3,1,7,7,2,5,5,4,6,5,7,5,1,6,2,2,6,7,2,1,5,1,2,7,6,4,4,6,1,6,2,1,,18,1,,1,4,,1,7,1,6,2,1,1,The question about speeding and safe driving seemed stragne,the purpose of the pilot study was to make sure you were understanding the questions we were going to be asked and responding to them in the way you would expect,The purpose of the main study was to see how I would react to hypothetical situations regarding my relationship and how that relate to my personality and how I react to other things.,Perhaps the Pilot study was done so the questions would put you in a certain frame of mind going into the main study,I didn't think they did but because I wasn't thinking about those questions. but they could have been lie a primer for my brain and influenced my answers.,I do not know if everybody received the same prompts but if they didn't I would assume that they would differ by one focusing on asking about how long relationship should last and the other focusing on ending relationships,1,1,1,Fuglestad,30.28779602,-81.42639923,-1,0
R_3HMOu2B0jyiR25d,Default Response Set,Anonymous,,,139.62.163.52,0,1/12/2016 13:38,1/12/2016 15:27,1,m021,1,1,1,1,8,7,1,4,0,0,8,0,8,7,4,8,2,6,1,1,1,7,7,5,3,8,1,4,2,4,6,7,0,4,0,0,8,8,0,8,7,7,0,2,6,0,8,1,7,7,0,1,1,7,8,8,0,7,8,8,5,3,2,2,3,3,3,1,1,5,3,2,4,1,5,1,7,6,6,6,6,2,1,1,1,3,3,3,3,5,1,6,7,6,7,2,1,7,2,7,1,,20,2,,1,4,,2,1,1,7,2,1,1,"No, everything was pretty straight forward.",To figure out whether the questions asked would be good questions to ask/if the type of person would be a good type to use in the study.,The purpose of the main study was to figure out how college students handle relationships and events that could happen during them.,I believe that the two studies were slightly related in the way they used the participant to use their own personal knowledge about dating relationships to answer the given questions.,"No, they did not have an affect on the way I answered in the study.","I believe everyone received the same writing prompts, however I am not completely sure, due to the fact that I took the study and pilot study alone.",1,1,2,Fuglestad,30.28779602,-81.42639923,-1,0
R_3sA3OlCN3rhhblS,Default Response Set,Anonymous,,,139.62.163.52,0,1/13/2016 8:41,1/13/2016 10:48,1,m022,1,1,1,2,6,3,0,4,1,3,5,5,6,2,2,5,2,4,1,1,2,2,6,5,1,4,2,4,2,4,2,3,1,4,1,0,4,3,3,6,7,4,1,0,4,2,4,1,2,7,2,1,1,7,6,5,2,5,6,4,5,4,2,2,5,5,4,5,6,3,3,5,5,2,6,3,4,3,4,5,2,3,4,2,3,5,6,3,3,4,1,3,6,1,5,2,2,2,2,3,1,,21,4,,1,4,,2,0,1,28,1,1,1,I was wondering why there were questions not related to relationships such as the questions about driving the speed limit.,The purpose was to see the reasons why people stay in steady relationships.,"since the study was for men, the purpose was to see how men would react to certain scenarios and to find out which sex handles situations more rationally.",I believe that they are related because the pilot study was made to get you in a certain mindset for when you take the main study.,The pilot study made me think about all of the best reasons why I am with my partner and thus made my answers tend to be more forgiving when doing the main study.,My prompts were all positive but others may have been all negative.,1,1,1,Fuglestad,30.28779602,-81.42639923,-1,2
R_AneD3ln37dl7eXn,Default Response Set,Anonymous,,,139.62.163.52,0,1/13/2016 13:29,1/13/2016 14:18,1,m023,1,1,1,3,5,5,4,4,0,0,3,0,7,0,0,6,0,8,3,0,0,7,2,4,0,7,0,0,0,0,0,7,0,4,0,0,0,8,0,1,5,6,0,0,6,0,6,3,0,5,0,1,1,6,4,2,5,3,2,6,7,4,6,7,3,7,3,6,4,7,7,5,7,5,4,2,6,4,7,7,7,3,7,1,1,3,7,3,1,4,7,3,7,1,4,3,7,3,7,4,1,,18,1,,1,2,,0,2,3,7,1,1,1,"Some of the questions seemed not to apply to the relationship, but rather to me as a person.",To determine what positive ideals I had about the relationship,To determine a general opinion as to how different portions of the relationship were.,The two studies were related through the basic focus on my relationship in the long run.,I believe the pilot study influenced my responses to become slightly more positive than it would have been beforehand,"I do not know, as I took the pilot study alone.",1,1,1,Fuglestad,30.28779602,-81.42639923,-1,2
R_ey9lER00G6tp7mp,Default Response Set,Anonymous,,,139.62.163.127,0,1/13/2016 14:22,1/13/2016 16:04,1,M024,1,1,1,2,3,3,0,5,0,0,8,0,5,5,2,6,2,5,2,0,0,4,5,4,1,6,0,0,1,0,5,0,2,7,0,0,4,3,0,6,6,7,0,0,7,0,8,0,5,6,0,1,1,6,6,4,0,7,4,4,2,2,6,6,3,7,5,7,6,3,6,3,5,6,6,2,5,6,7,4,5,3,2,1,1,4,2,5,2,6,1,6,7,7,6,7,2,7,1,7,1,,21,3,,1,3,,1,4,1,17,1,1,1,I always wonder when answering the agree or disagree questions how truthful tend to be on these sorts of studies. For a few I didn't disagree or agree and that made it difficult to answer the question.,To understand why you're in a relationship and how controlling the relationship is.,To understand the behavior and reactions to mischievous events in dating relationships.,They seemed related just because they're both about relationships.,No,I'm not sure. I didn't see the other papers.,1,1,2,Fuglestad,30.28779602,-81.42639923,-1,0
R_3P5l9i86G6oFdKZ,Default Response Set,Anonymous,,,139.62.163.52,0,1/13/2016 14:19,1/13/2016 16:05,1,M025,1,1,1,0,5,3,4,4,0,4,7,2,8,1,2,8,1,6,1,0,2,4,8,1,4,4,0,0,3,4,8,8,0,7,0,0,0,5,3,8,5,8,0,0,1,0,7,2,8,7,0,1,1,6,8,8,4,7,4,8,6,7,4,4,7,5,3,1,1,6,1,6,1,3,4,1,3,7,7,3,6,1,1,1,1,1,7,5,1,7,3,1,7,7,7,7,7,6,7,4,1,,19,1,,1,4,,1,6,1,1,2,1,1,there was nothing that stood out as strange.,to give the researchers an overall view of how shallow or not shallow our relationship is.,"to give the researchers a set of responses to hypothetical events based on your ""shallowness profile"" from the pilot study.",I think they were and that the first paper was used to get an overall look at my opinions about my partner and our relationship to describe our relationship so that the researchers would have a profile of traits to associate my answers with,not really I just answered how I normally would have answered,"I wouldn't know if the other people had a different prompt. but if they did, then my theory on how they are related to the online questionnaire could be wrong. ",1,1,2,Fuglestad,30.28779602,-81.42639923,-1,2
